{
  "accepted_variant_count": 11,
  "active_opcode_count": 212,
  "codegen_eligible": false,
  "execution_boundaries": [
    "container_clone_execution",
    "string_and_array_operation_semantics",
    "object_lifecycle",
    "destructor_exception_cleanup",
    "runtime_reference_binding",
    "dynamic_symbol_table_aliasing",
    "call_execution",
    "internal_c_abi_interop"
  ],
  "format_version": 1,
  "live_w06_deferred_count": 87,
  "mir_contract_version": "1.9",
  "modeled_semantics": [
    "zval_storage_model",
    "reference_cell_model",
    "indirect_slot_model",
    "refcount_transfer_model",
    "alias_partition_model",
    "separation_protocol_model",
    "direct_user_call_reference_transfer_model",
    "refcounted_call_result_model"
  ],
  "opcodes": [
    {
      "decision": "inherited",
      "later_wave": null,
      "number": 0,
      "opcode": "ZEND_NOP",
      "proofs": [
        "source_cfg_complete",
        "reducible_cfg",
        "no_protected_regions",
        "branch_successor_order_exact",
        "phi_predecessor_order_exact",
        "edge_statepoints_complete",
        "no_calls",
        "no_reentry"
      ],
      "rationale": "Inherited unchanged from the live W05-v2 profile.",
      "source_refs": [
        {
          "end_line": 8168,
          "path": "Zend/zend_vm_def.h",
          "start_line": 8162,
          "symbol": "ZEND_NOP"
        },
        {
          "end_line": 2729,
          "path": "ext/opcache/jit/zend_jit.c",
          "start_line": 2729,
          "symbol": "ZEND_NOP"
        }
      ],
      "transition_family": "inherited",
      "w05_classification": "inherited",
      "w05_deferred_wave": null
    },
    {
      "decision": "inherited",
      "later_wave": null,
      "number": 1,
      "opcode": "ZEND_ADD",
      "proofs": [
        "source_cfg_complete",
        "reducible_cfg",
        "no_protected_regions",
        "branch_successor_order_exact",
        "phi_predecessor_order_exact",
        "edge_statepoints_complete",
        "no_calls",
        "no_reentry",
        "exact_scalar_types",
        "no_overflow",
        "no_destructor",
        "no_exception"
      ],
      "rationale": "Inherited unchanged from the live W05-v2 profile.",
      "source_refs": [
        {
          "end_line": 45,
          "path": "Zend/zend_vm_def.h",
          "start_line": 25,
          "symbol": "zend_add_helper"
        },
        {
          "end_line": 83,
          "path": "Zend/zend_vm_def.h",
          "start_line": 46,
          "symbol": "ZEND_ADD"
        },
        {
          "end_line": 1712,
          "path": "ext/opcache/jit/zend_jit.c",
          "start_line": 1712,
          "symbol": "ZEND_ADD"
        },
        {
          "end_line": 4551,
          "path": "ext/opcache/jit/zend_jit_trace.c",
          "start_line": 4551,
          "symbol": "ZEND_ADD"
        }
      ],
      "transition_family": "inherited",
      "w05_classification": "inherited",
      "w05_deferred_wave": null
    },
    {
      "decision": "inherited",
      "later_wave": null,
      "number": 2,
      "opcode": "ZEND_SUB",
      "proofs": [
        "source_cfg_complete",
        "reducible_cfg",
        "no_protected_regions",
        "branch_successor_order_exact",
        "phi_predecessor_order_exact",
        "edge_statepoints_complete",
        "no_calls",
        "no_reentry",
        "exact_scalar_types",
        "no_overflow",
        "no_destructor",
        "no_exception"
      ],
      "rationale": "Inherited unchanged from the live W05-v2 profile.",
      "source_refs": [
        {
          "end_line": 104,
          "path": "Zend/zend_vm_def.h",
          "start_line": 84,
          "symbol": "zend_sub_helper"
        },
        {
          "end_line": 142,
          "path": "Zend/zend_vm_def.h",
          "start_line": 105,
          "symbol": "ZEND_SUB"
        },
        {
          "end_line": 1713,
          "path": "ext/opcache/jit/zend_jit.c",
          "start_line": 1713,
          "symbol": "ZEND_SUB"
        },
        {
          "end_line": 4552,
          "path": "ext/opcache/jit/zend_jit_trace.c",
          "start_line": 4552,
          "symbol": "ZEND_SUB"
        }
      ],
      "transition_family": "inherited",
      "w05_classification": "inherited",
      "w05_deferred_wave": null
    },
    {
      "decision": "inherited",
      "later_wave": null,
      "number": 3,
      "opcode": "ZEND_MUL",
      "proofs": [
        "source_cfg_complete",
        "reducible_cfg",
        "no_protected_regions",
        "branch_successor_order_exact",
        "phi_predecessor_order_exact",
        "edge_statepoints_complete",
        "no_calls",
        "no_reentry",
        "exact_scalar_types",
        "no_overflow",
        "no_destructor",
        "no_exception"
      ],
      "rationale": "Inherited unchanged from the live W05-v2 profile.",
      "source_refs": [
        {
          "end_line": 163,
          "path": "Zend/zend_vm_def.h",
          "start_line": 143,
          "symbol": "zend_mul_helper"
        },
        {
          "end_line": 204,
          "path": "Zend/zend_vm_def.h",
          "start_line": 164,
          "symbol": "ZEND_MUL"
        },
        {
          "end_line": 1714,
          "path": "ext/opcache/jit/zend_jit.c",
          "start_line": 1714,
          "symbol": "ZEND_MUL"
        },
        {
          "end_line": 4553,
          "path": "ext/opcache/jit/zend_jit_trace.c",
          "start_line": 4553,
          "symbol": "ZEND_MUL"
        }
      ],
      "transition_family": "inherited",
      "w05_classification": "inherited",
      "w05_deferred_wave": null
    },
    {
      "decision": "deferred",
      "later_wave": "W16",
      "number": 4,
      "opcode": "ZEND_DIV",
      "proofs": [],
      "rationale": "Unrelated scalar arithmetic gap.",
      "source_refs": [
        {
          "end_line": 218,
          "path": "Zend/zend_vm_def.h",
          "start_line": 205,
          "symbol": "ZEND_DIV"
        },
        {
          "end_line": 1398,
          "path": "ext/opcache/jit/zend_jit.c",
          "start_line": 1398,
          "symbol": "ZEND_DIV"
        }
      ],
      "transition_family": "none",
      "w05_classification": "deferred",
      "w05_deferred_wave": "W06"
    },
    {
      "decision": "inherited",
      "later_wave": null,
      "number": 5,
      "opcode": "ZEND_MOD",
      "proofs": [
        "source_cfg_complete",
        "reducible_cfg",
        "no_protected_regions",
        "branch_successor_order_exact",
        "phi_predecessor_order_exact",
        "edge_statepoints_complete",
        "no_calls",
        "no_reentry",
        "exact_scalar_types",
        "nonzero_divisor",
        "no_overflow",
        "no_exception"
      ],
      "rationale": "Inherited unchanged from the live W05-v2 profile.",
      "source_refs": [
        {
          "end_line": 228,
          "path": "Zend/zend_vm_def.h",
          "start_line": 219,
          "symbol": "zend_mod_by_zero_helper"
        },
        {
          "end_line": 249,
          "path": "Zend/zend_vm_def.h",
          "start_line": 229,
          "symbol": "zend_mod_helper"
        },
        {
          "end_line": 276,
          "path": "Zend/zend_vm_def.h",
          "start_line": 250,
          "symbol": "ZEND_MOD"
        },
        {
          "end_line": 1668,
          "path": "ext/opcache/jit/zend_jit.c",
          "start_line": 1668,
          "symbol": "ZEND_MOD"
        },
        {
          "end_line": 4517,
          "path": "ext/opcache/jit/zend_jit_trace.c",
          "start_line": 4517,
          "symbol": "ZEND_MOD"
        }
      ],
      "transition_family": "inherited",
      "w05_classification": "inherited",
      "w05_deferred_wave": null
    },
    {
      "decision": "inherited",
      "later_wave": null,
      "number": 6,
      "opcode": "ZEND_SL",
      "proofs": [
        "source_cfg_complete",
        "reducible_cfg",
        "no_protected_regions",
        "branch_successor_order_exact",
        "phi_predecessor_order_exact",
        "edge_statepoints_complete",
        "no_calls",
        "no_reentry",
        "exact_scalar_types",
        "valid_shift_count",
        "no_overflow"
      ],
      "rationale": "Inherited unchanged from the live W05-v2 profile.",
      "source_refs": [
        {
          "end_line": 297,
          "path": "Zend/zend_vm_def.h",
          "start_line": 277,
          "symbol": "zend_shift_left_helper"
        },
        {
          "end_line": 318,
          "path": "Zend/zend_vm_def.h",
          "start_line": 298,
          "symbol": "ZEND_SL"
        },
        {
          "end_line": 1666,
          "path": "ext/opcache/jit/zend_jit.c",
          "start_line": 1666,
          "symbol": "ZEND_SL"
        },
        {
          "end_line": 4515,
          "path": "ext/opcache/jit/zend_jit_trace.c",
          "start_line": 4515,
          "symbol": "ZEND_SL"
        }
      ],
      "transition_family": "inherited",
      "w05_classification": "inherited",
      "w05_deferred_wave": null
    },
    {
      "decision": "inherited",
      "later_wave": null,
      "number": 7,
      "opcode": "ZEND_SR",
      "proofs": [
        "source_cfg_complete",
        "reducible_cfg",
        "no_protected_regions",
        "branch_successor_order_exact",
        "phi_predecessor_order_exact",
        "edge_statepoints_complete",
        "no_calls",
        "no_reentry",
        "exact_scalar_types",
        "valid_shift_count"
      ],
      "rationale": "Inherited unchanged from the live W05-v2 profile.",
      "source_refs": [
        {
          "end_line": 339,
          "path": "Zend/zend_vm_def.h",
          "start_line": 319,
          "symbol": "zend_shift_right_helper"
        },
        {
          "end_line": 358,
          "path": "Zend/zend_vm_def.h",
          "start_line": 340,
          "symbol": "ZEND_SR"
        },
        {